{
  "question": "How do I recover an Edge Gateway after firmware upgrade failure?",
  "product_line": "northstar_edge_gateway",
  "actor_role": "support_engineer",
  "visibility_scope": "internal",
  "entitlement_tier": "enterprise",
  "top_k": 5,
  "index_release_id": "index-week08-dev",
  "data_release_id": "data-week08-dev",
  "prompt_release_id": "prompt-week08-v1",
  "include_debug": true
}
